<?xml version="1.0" encoding="UTF-8"?>
<curriculum xmlns:xsi="http://www.w3.org/2001/XMLSchema-instance"
xsi:noNamespaceSchemaLocation="alberto_bolta.xsd">

    <datos_personales>
        <nombre>Alberto</nombre>
        <apellidos>Bolta Sanmateu</apellidos>
        <fecha_nacimiento>
            <dia>08</dia>
            <mes>01</mes>
            <año>1987</año>
        </fecha_nacimiento>
        <lugar_nacimiento>Gandia</lugar_nacimiento>
        <nacionalidad>España</nacionalidad>
        <dni>53384069B</dni>
        <foto>C:/Users/admin/OneDrive/Escritorio/FP/LMSGI - LENGUAJES DE MARCAS Y SISTEMAS DE GESTION DE LA INFORMACION/fotocarnet.png</foto>
    </datos_personales>

    <datos_direccion_contacto>
        <domicilio>
            <tipo_via>Plaza</tipo_via>
            <nombre_via>Ciudad de la Lisa</nombre_via>
            <numero>8</numero>
            <piso>Entresuelo</piso>
            <puerta>1</puerta>
            <codigo_postal>46920</codigo_postal>
            <pais>España</pais>
            <provincia>Valencia</provincia>
            <municipio>Mislata</municipio>
        </domicilio>
        <correo_electronico>
            <email uso = 'personal'>a.bolta@gmail.com</email>
            <email uso = 'profesional'>a.bolta@alfatrainers.com</email>
        </correo_electronico>
        <telefonos>
            <telefono tipo = 'movil'>622363288</telefono>
            <telefono tipo = 'fijo'></telefono>
        </telefonos>
    </datos_direccion_contacto>

    <otros_datos>
        <pagina_web></pagina_web>
        <redes_sociales>
            <perfil nombre = 'Linkedin'>https://www.linkedin.com/in/alberto-bolta-sanmateu-b43188306</perfil>
            <perfil nombre = 'Repositorio'>https://github.com/Lokhy87</perfil>
        </redes_sociales>
    </otros_datos>
    
    <formacion>
        <titulacion>
            <nombre>Licenciatura en Ciencias de la Actividad Fisica y el Deporte</nombre>
            <centro>Universidad Catolica de Valencia</centro>
            <fecha_inicio>
                <mes>Septiembre</mes> 
                <año>2005</año>
            </fecha_inicio>
            <fecha_finalizacion>
                <mes>Junio</mes> 
                <año>2010</año>
            </fecha_finalizacion>
        </titulacion>
        <titulacion>
            <nombre>Bootcamp Data Science</nombre>
            <centro>The Bridge</centro>
            <fecha_inicio>
                <mes>Febrero</mes> 
                <año>2024</año>
            </fecha_inicio>
            <fecha_finalizacion>
                <mes>Agosto</mes> 
                <año>2024</año>
            </fecha_finalizacion>
        </titulacion>
    </formacion>
    
    <idiomas>
        <idioma materno = 'true'>
            <nombre>Castellano</nombre>
            <expresion_oral>Alto</expresion_oral>
            <comprension_oral>Alto</comprension_oral>
            <expresion_escrita>Alto</expresion_escrita>
        </idioma>
        <idioma materno = 'false'>
            <nombre>Inglés</nombre>
            <expresion_oral>Medio</expresion_oral>
            <comprension_oral>Medio</comprension_oral>
            <expresion_escrita>Medio</expresion_escrita>
        </idioma>
        <idioma materno = 'true'>
            <nombre>Valenciano</nombre>
            <expresion_oral>Alto</expresion_oral>
            <comprension_oral>Alto</comprension_oral>
            <expresion_escrita>Medio</expresion_escrita>
        </idioma>
        <idioma materno = 'false'>
            <nombre>Italiano</nombre>
            <expresion_oral>Medio</expresion_oral>
            <comprension_oral>Medio</comprension_oral>
            <expresion_escrita>Medio</expresion_escrita>
        </idioma>
    </idiomas>
    
    <experiencia_laboral>
        <empresa>
            <nombre>Alfa Trainners</nombre>
            <puesto>Entrenador personal</puesto>
            <inicio_contrato>
                <dia>26</dia>
                <mes>Noviembre</mes> 
                <año>2023</año>
            </inicio_contrato>
            <final_contrato>
                <dia></dia>
                <mes></mes> 
                <año></año>
            </final_contrato>
        </empresa>
        <empresa>
            <nombre>TennisTrainer</nombre>
            <puesto>Preparador fisico y entrenador</puesto>
            <inicio_contrato>
                <dia>10</dia>
                <mes>Julio</mes> 
                <año>2013</año>
            </inicio_contrato>
            <final_contrato>
                <dia>1</dia>
                <mes>Junio</mes> 
                <año>2021</año>
            </final_contrato>
        </empresa>
    </experiencia_laboral>
    
    <competencias>
        <competencia>
            <nombre>Liderazgo</nombre>
            <nivel>2</nivel>
        </competencia>
        <competencia>
            <nombre>Trabajo en equipo</nombre>
            <nivel>5</nivel>
        </competencia>
        <competencia>
            <nombre>Iniciativa</nombre>
            <nivel>2</nivel>
        </competencia>
        <competencia>
            <nombre>Creatividad</nombre>
            <nivel>3</nivel>
        </competencia>
        <competencia>
            <nombre>Autonomía</nombre>
            <nivel>4</nivel>
        </competencia>
    </competencias>
    
    <datos_adicionales>
        <aficiones>
            <nombre>Deportes</nombre>
        </aficiones>
        <disponibilidad_viajar>Si</disponibilidad_viajar>
        <vehiculo_propio>Si</vehiculo_propio>
        <permisos>
            <nombre licencia = 'B1'>Coche</nombre>
            <nombre licencia = 'C'>Camion</nombre>
            <nombre licencia = 'C+E'>Trailer</nombre>
        </permisos>
    </datos_adicionales>
</curriculum>
